{
  "$schema": "./portfolio.schema.json",
  "meta": {
    "schemaVersion": 1,
    "updatedAt": "2026-09-27T11:14:50.040Z"
  },
  "profile": {
    "name": {
      "en": "Asadkhon Rasulov",
      "uz": "Asadxon Rasulov",
      "ru": "Асадхон Расулов"
    },
    "headline": {
      "en": "Software Engineer & Game Developer",
      "uz": "Dasturiy ta’minot muhandisi va o‘yin dasturchisi",
      "ru": "Инженер-программист и разработчик игр"
    },
    "summary": {
      "en": "Computer Science graduate from the University of Arizona with a minor in Game Design & Development. I build web apps and games, and over two years as a teaching assistant taught me to explain complex systems — from MIPS assembly to calculus — clearly and patiently.",
      "uz": "Arizona universitetining Kompyuter fanlari yo‘nalishi bitiruvchisiman, qo‘shimcha mutaxassisligim — o‘yin dizayni va ishlab chiqish. Veb-ilovalar va o‘yinlar yarataman. Ikki yildan ortiq o‘qituvchi assistenti bo‘lib ishlaganim menga murakkab tizimlarni — MIPS assemblerdan tortib matematik analizgacha — aniq va sabr bilan tushuntirishni o‘rgatdi.",
      "ru": "Выпускник Университета Аризоны по специальности «Компьютерные науки» с дополнительной специализацией в геймдизайне и разработке игр. Создаю веб-приложения и игры, а более двух лет работы ассистентом преподавателя научили меня ясно и терпеливо объяснять сложные системы — от ассемблера MIPS до математического анализа."
    },
    "location": {
      "en": "Uzbekistan",
      "uz": "O‘zbekiston",
      "ru": "Узбекистан"
    },
    "avatar": "/uploads/portrait.jpg",
    "avatarAlt": {
      "en": "Portrait of Asadkhon Rasulov",
      "uz": "Asadxon Rasulov portreti",
      "ru": "Портрет Асадхона Расулова"
    },
    "status": {
      "enabled": true,
      "text": {
        "en": "Open to software & game development roles",
        "uz": "Dasturlash va o‘yin ishlab chiqish bo‘yicha takliflarga ochiqman",
        "ru": "Открыт к предложениям в разработке ПО и игр"
      }
    },
    "contacts": [
      {
        "id": "c-email",
        "kind": "email",
        "label": {
          "en": "Email",
          "uz": "Email",
          "ru": "Email"
        },
        "value": "armain319@gmail.com",
        "url": "",
        "onSite": true,
        "onResume": true
      },
      {
        "id": "c-github",
        "kind": "github",
        "label": {
          "en": "GitHub"
        },
        "value": "github.com/Alan7w",
        "url": "https://github.com/Alan7w",
        "onSite": true,
        "onResume": true
      },
      {
        "id": "c-telegram",
        "kind": "telegram",
        "label": {
          "en": "Telegram"
        },
        "value": "@ras1x7",
        "url": "",
        "onSite": true,
        "onResume": true
      },
      {
        "id": "c-itch",
        "kind": "itch",
        "label": {
          "en": "Games",
          "uz": "O‘yinlar",
          "ru": "Игры"
        },
        "value": "defenders-group8.itch.io",
        "url": "https://defenders-group8.itch.io/",
        "onSite": true,
        "onResume": false
      }
    ],
    "highlights": [
      {
        "id": "h-gpa",
        "value": {
          "en": "3.77"
        },
        "label": {
          "en": "GPA · B.A. Computer Science",
          "uz": "GPA · Kompyuter fanlari bakalavri",
          "ru": "GPA · бакалавр компьютерных наук"
        }
      },
      {
        "id": "h-teaching",
        "value": {
          "en": "2+ yrs",
          "uz": "2+ yil",
          "ru": "2+ года"
        },
        "label": {
          "en": "Teaching CS & math at the University of Arizona",
          "uz": "Arizona universitetida informatika va matematikadan assistentlik",
          "ru": "преподавания CS и математики в Университете Аризоны"
        }
      },
      {
        "id": "h-games",
        "value": {
          "en": "2"
        },
        "label": {
          "en": "Team games released on itch.io",
          "uz": "itch.io’da chiqarilgan jamoaviy o‘yinlar",
          "ru": "командные игры, выпущенные на itch.io"
        }
      },
      {
        "id": "h-projects",
        "value": {
          "en": "10+"
        },
        "label": {
          "en": "Web, systems & game projects",
          "uz": "Veb, tizimli va o‘yin loyihalari",
          "ru": "веб-, системных и игровых проектов"
        }
      }
    ]
  },
  "sections": [
    {
      "id": "sec-skills",
      "kind": "skills",
      "title": {
        "en": "Skills",
        "uz": "Ko‘nikmalar",
        "ru": "Навыки"
      },
      "intro": {
        "en": "Tap a skill to see where I’ve used it.",
        "uz": "Qayerda qo‘llaganimni ko‘rish uchun ko‘nikmani bosing.",
        "ru": "Нажмите на навык, чтобы увидеть, где я его применял."
      },
      "hidden": false,
      "hideOnResume": false,
      "layout": "auto",
      "items": [
        {
          "id": "sk-languages",
          "title": {
            "en": "Programming languages",
            "uz": "Dasturlash tillari",
            "ru": "Языки программирования"
          },
          "subtitle": {},
          "url": "",
          "location": {},
          "start": "",
          "end": "",
          "type": "",
          "summary": {},
          "body": {},
          "bullets": [],
          "tags": [
            "Python",
            "Java",
            "C",
            "C#",
            "JavaScript",
            "TypeScript",
            "HTML",
            "CSS",
            "Bash",
            "MIPS Assembly"
          ],
          "links": [],
          "facts": [],
          "image": "",
          "imageAlt": {},
          "featured": false,
          "hidden": false,
          "hideOnResume": false
        },
        {
          "id": "sk-web",
          "title": {
            "en": "Web & frameworks",
            "uz": "Veb va frameworklar",
            "ru": "Веб и фреймворки"
          },
          "subtitle": {},
          "url": "",
          "location": {},
          "start": "",
          "end": "",
          "type": "",
          "summary": {},
          "body": {},
          "bullets": [],
          "tags": [
            "React",
            "Next.js",
            "Tailwind CSS",
            "Node.js",
            "REST APIs",
            "JavaFX",
            "Accessibility"
          ],
          "links": [],
          "facts": [],
          "image": "",
          "imageAlt": {},
          "featured": false,
          "hidden": false,
          "hideOnResume": false
        },
        {
          "id": "sk-games",
          "title": {
            "en": "Game development",
            "uz": "O‘yin ishlab chiqish",
            "ru": "Разработка игр"
          },
          "subtitle": {},
          "url": "",
          "location": {},
          "start": "",
          "end": "",
          "type": "",
          "summary": {},
          "body": {},
          "bullets": [],
          "tags": [
            "Unity",
            "Blender",
            "Game Design",
            "Pixel Art",
            "Gamification"
          ],
          "links": [],
          "facts": [],
          "image": "",
          "imageAlt": {},
          "featured": false,
          "hidden": false,
          "hideOnResume": false
        },
        {
          "id": "sk-cs",
          "title": {
            "en": "CS foundations",
            "uz": "Informatika asoslari",
            "ru": "Основы Computer Science"
          },
          "subtitle": {},
          "url": "",
          "location": {},
          "start": "",
          "end": "",
          "type": "",
          "summary": {},
          "body": {},
          "bullets": [],
          "tags": [
            "Data Structures & Algorithms",
            "Computer Architecture",
            "Systems Programming",
            "Compilers",
            "Object-Oriented Programming"
          ],
          "links": [],
          "facts": [],
          "image": "",
          "imageAlt": {},
          "featured": false,
          "hidden": false,
          "hideOnResume": true
        },
        {
          "id": "sk-tools",
          "title": {
            "en": "Tools & platforms",
            "uz": "Vositalar va platformalar",
            "ru": "Инструменты и платформы"
          },
          "subtitle": {},
          "url": "",
          "location": {},
          "start": "",
          "end": "",
          "type": "",
          "summary": {},
          "body": {},
          "bullets": [],
          "tags": [
            "Git",
            "GitHub",
            "Linux / Unix",
            "VS Code",
            "Google Workspace",
            "Microsoft Office"
          ],
          "links": [],
          "facts": [],
          "image": "",
          "imageAlt": {},
          "featured": false,
          "hidden": false,
          "hideOnResume": false
        },
        {
          "id": "sk-people",
          "title": {
            "en": "Teaching & leadership",
            "uz": "O‘qitish va yetakchilik",
            "ru": "Преподавание и лидерство"
          },
          "subtitle": {},
          "url": "",
          "location": {},
          "start": "",
          "end": "",
          "type": "",
          "summary": {},
          "body": {},
          "bullets": [],
          "tags": [
            "Teaching",
            "Mentoring",
            "Tutoring",
            "Leadership",
            "Project Management",
            "Event Organization",
            "Research"
          ],
          "links": [],
          "facts": [],
          "image": "",
          "imageAlt": {},
          "featured": false,
          "hidden": false,
          "hideOnResume": true
        }
      ]
    },
    {
      "id": "sec-projects",
      "kind": "projects",
      "title": {
        "en": "Projects",
        "uz": "Loyihalar",
        "ru": "Проекты"
      },
      "intro": {},
      "hidden": false,
      "hideOnResume": false,
      "layout": "auto",
      "items": [